{
  "timestamp": "2026-07-08T10:15:32.402Z",
  "level": "info",
  "service": "worker",
  "environment": "production",
  "event_type": "http_request",
  "message": "Reserva creada correctamente",
  "request_id": "req_8f2c1a90b1",
  "correlation_id": "corr_5b71e3d4aa",
  "client_id": "club-padel-04",
  "tenant_id": null,
  "scenario_id": "5697630",
  "execution_id": null,
  "user_id_hash": "a1b2c3d4e5f60718",
  "error_code": null,
  "duration_ms": 142,
  "status": "success",
  "metadata": { "route": "/api/reservas", "method": "POST", "court": "Pista 2" }
}
